{
  "$schema": "./schema.json",
  "version": "1.0.0",
  "description": "YYC³ 统一 Agent 角色注册表 — 合并 Agent/ 与 agents/ 角色定义，去除重复",
  "roles": [
    {
      "id": "AGT-backend-architect",
      "name": "Backend Architect",
      "description": "后端架构设计专家",
      "category": "engineering",
      "source": "agents-hub/roles/core-agents/backend-architect.md",
      "capabilities": ["architecture", "api-design", "database", "scalability"],
      "tags": ["backend", "architecture", "system-design"],
      "status": "active"
    },
    {
      "id": "AGT-code-reviewer",
      "name": "Code Reviewer",
      "description": "代码审查专家",
      "category": "engineering",
      "source": "agents-hub/roles/core-agents/code-reviewer.md",
      "capabilities": ["code-review", "security", "quality", "best-practices"],
      "tags": ["review", "quality", "security"],
      "status": "active"
    },
    {
      "id": "AGT-debugger",
      "name": "Debugger",
      "description": "调试排错专家",
      "category": "engineering",
      "source": "agents-hub/roles/core-agents/debugger.md",
      "capabilities": ["debugging", "error-analysis", "root-cause", "profiling"],
      "tags": ["debug", "troubleshooting"],
      "status": "active"
    },
    {
      "id": "AGT-tdd-orchestrator",
      "name": "TDD Orchestrator",
      "description": "测试驱动开发编排器",
      "category": "engineering",
      "source": "agents-hub/roles/core-agents/tdd-orchestrator.md",
      "capabilities": ["tdd", "testing", "refactoring", "ci-cd"],
      "tags": ["tdd", "testing", "quality"],
      "status": "active"
    },
    {
      "id": "AGT-test-automator",
      "name": "Test Automator",
      "description": "自动化测试专家",
      "category": "engineering",
      "source": "agents-hub/roles/core-agents/test-automator.md",
      "capabilities": ["automation", "e2e", "unit-testing", "integration-testing"],
      "tags": ["testing", "automation", "qa"],
      "status": "active"
    },
    {
      "id": "AGT-task-orchestrator",
      "name": "Task Orchestrator",
      "description": "任务编排调度器",
      "category": "workflow",
      "source": "agents-hub/roles/core-agents/task-orchestrator.md",
      "capabilities": ["task-management", "scheduling", "coordination"],
      "tags": ["orchestration", "workflow"],
      "status": "active"
    },
    {
      "id": "AGT-task-executor",
      "name": "Task Executor",
      "description": "任务执行器",
      "category": "workflow",
      "source": "agents-hub/roles/core-agents/task-executor.md",
      "capabilities": ["execution", "monitoring", "reporting"],
      "tags": ["execution", "automation"],
      "status": "active"
    },
    {
      "id": "AGT-task-checker",
      "name": "Task Checker",
      "description": "任务检查验证器",
      "category": "workflow",
      "source": "agents-hub/roles/core-agents/task-checker.md",
      "capabilities": ["validation", "verification", "quality-check"],
      "tags": ["verification", "quality"],
      "status": "active"
    },
    {
      "id": "AGT-graphql-architect",
      "name": "GraphQL Architect",
      "description": "GraphQL 架构设计专家",
      "category": "engineering",
      "source": "agents-hub/roles/core-agents/graphql-architect.md",
      "capabilities": ["graphql", "schema-design", "api", "federation"],
      "tags": ["graphql", "api", "architecture"],
      "status": "active"
    },
    {
      "id": "AGT-browser-user",
      "name": "Browser User",
      "description": "浏览器交互代理",
      "category": "automation",
      "source": "agents-hub/roles/core-agents/browser-user.md",
      "capabilities": ["browser-automation", "web-scraping", "ui-testing"],
      "tags": ["browser", "automation", "web"],
      "status": "active"
    },
    {
      "id": "AGT-agent-sdk-verifier-py",
      "name": "Agent SDK Verifier (Python)",
      "description": "Python Agent SDK 验证器",
      "category": "verification",
      "source": "agents-hub/roles/core-agents/agent-sdk-verifier-py.md",
      "capabilities": ["sdk", "python", "verification", "testing"],
      "tags": ["sdk", "python", "verification"],
      "status": "active"
    },
    {
      "id": "AGT-agent-sdk-verifier-ts",
      "name": "Agent SDK Verifier (TypeScript)",
      "description": "TypeScript Agent SDK 验证器",
      "category": "verification",
      "source": "agents-hub/roles/core-agents/agent-sdk-verifier-ts.md",
      "capabilities": ["sdk", "typescript", "verification", "testing"],
      "tags": ["sdk", "typescript", "verification"],
      "status": "active"
    },
    {
      "id": "AGT-c-pro",
      "name": "C Programming Expert",
      "description": "C 语言编程专家",
      "category": "language-expert",
      "source": "agents-hub/roles/core-agents/c-pro.md",
      "capabilities": ["c", "systems", "pointers", "memory-management"],
      "tags": ["c", "systems", "low-level"],
      "status": "active"
    },
    {
      "id": "AGT-cpp-pro",
      "name": "C++ Programming Expert",
      "description": "C++ 语言编程专家",
      "category": "language-expert",
      "source": "agents-hub/roles/core-agents/cpp-pro.md",
      "capabilities": ["cpp", "stl", "template-metaprogramming", "memory"],
      "tags": ["cpp", "systems", "performance"],
      "status": "active"
    },
    {
      "id": "AGT-rust-pro",
      "name": "Rust Programming Expert",
      "description": "Rust 语言编程专家",
      "category": "language-expert",
      "source": "agents-hub/roles/core-agents/rust-pro.md",
      "capabilities": ["rust", "ownership", "async", "wasm"],
      "tags": ["rust", "systems", "safety"],
      "status": "active"
    },
    {
      "id": "AGT-golang-pro",
      "name": "Go Programming Expert",
      "description": "Go 语言编程专家",
      "category": "language-expert",
      "source": "agents-hub/roles/core-agents/golang-pro.md",
      "capabilities": ["go", "goroutines", "grpc", "microservices"],
      "tags": ["go", "concurrency", "backend"],
      "status": "active"
    },
    {
      "id": "AGT-php-pro",
      "name": "PHP Programming Expert",
      "description": "PHP 语言编程专家",
      "category": "language-expert",
      "source": "agents-hub/roles/core-agents/php-pro.md",
      "capabilities": ["php", "laravel", "symfony", "web"],
      "tags": ["php", "web", "backend"],
      "status": "active"
    },
    {
      "id": "AGT-ruby-pro",
      "name": "Ruby Programming Expert",
      "description": "Ruby 语言编程专家",
      "category": "language-expert",
      "source": "agents-hub/roles/core-agents/ruby-pro.md",
      "capabilities": ["ruby", "rails", "metaprogramming", "web"],
      "tags": ["ruby", "rails", "web"],
      "status": "active"
    },
    {
      "id": "AGT-weixin-minigame-helper",
      "name": "WeChat Mini Game Helper",
      "description": "微信小游戏开发助手",
      "category": "domain-expert",
      "source": "agents-hub/roles/core-agents/weixin-minigame-helper.md",
      "capabilities": ["wechat", "minigame", "canvas", "weapp"],
      "tags": ["wechat", "minigame", "frontend"],
      "status": "active"
    },
    {
      "id": "AGT-theme-factory",
      "name": "Theme Factory",
      "description": "主题工厂技能（从 Claude Plugin 市场整合）",
      "category": "creative",
      "source": "agents-hub/roles/core-agents/SKILL.md",
      "capabilities": ["theming", "design-system", "css", "branding"],
      "tags": ["theme", "design", "ui"],
      "status": "active"
    }
  ],
  "stats": {
    "totalRoles": 20,
    "byCategory": {
      "engineering": 6,
      "workflow": 3,
      "language-expert": 6,
      "automation": 1,
      "verification": 2,
      "domain-expert": 1,
      "creative": 1
    },
    "duplicatesRemoved": 1,
    "duplicatesNote": "已删除 'code-reviewer copy.md'（与 code-reviewer.md 完全重复）"
  }
}
